{
  "schema_version": "1.0.0",
  "observation_id": "b2be0990-8f85-4b46-bf3f-b6a7119a9d11",
  "phenomenon": "air_temperature",
  "value": 302.15,
  "unit": "K",
  "uncertainty": 0.2,
  "trace": false,
  "geometry": {"type": "Point", "coordinates": [-74.006, 40.7128, 10.0]},
  "vertical_coordinate": {"type": "height", "value": 2.0, "unit": "m"},
  "observation_time": "2026-07-20T18:00:00Z",
  "ingestion_time": "2026-07-20T18:01:03Z",
  "quality_disposition": "accept",
  "quality_flags": [],
  "provenance": {
    "source_id": "synthetic-development-source",
    "source_uri": "https://example.invalid/observations/temperature",
    "source_published_at": "2026-07-20T18:00:30Z",
    "source_record_digest": "sha256:3a38d4f0f4d45eb0fef35c6e31be9313cf3f2e7f72f35bcb44c2998c54c1a71f",
    "received_at": "2026-07-20T18:00:41Z",
    "ingested_at": "2026-07-20T18:01:03Z",
    "decoder_version": "json-observation-adapter/0.1.0",
    "license_id": "development-only"
  }
}
